{
  "slug": "shopify",
  "app": {
    "name": "Shopify",
    "website": "https://www.shopify.com",
    "category": "E-commerce",
    "developer_portal_url": "https://dev.shopify.com/dashboard",
    "docs_url": "https://shopify.dev/docs/apps/build/authentication-authorization/access-tokens/authorization-code-grant"
  },
  "composio": {
    "toolkit_slug": "SHOPIFY",
    "managed_oauth": "bring-your-own",
    "note": "Composio has no managed Shopify OAuth app, so you must register your own Shopify app and follow this guide before any user can connect. The distribution method you pick in Shopify (custom vs public) decides whether one store or arbitrary merchants can connect through your Composio auth config."
  },
  "verdict": {
    "tier": "approval-gated",
    "difficulty": 4,
    "headline": "One store (or one Plus organization) can connect today via custom distribution; letting arbitrary merchants connect requires a public app that passes Shopify App Store review, even if it is unlisted.",
    "summary": "Creating the app and connecting a development store takes under an hour. The hard part is multi-merchant distribution: public apps must pass App Store review, meet the full App Store requirements (Shopify Billing for any charges, OAuth started from a Shopify surface, compliance webhooks, GraphQL Admin API only, a UI), and request protected customer data access for names, emails, phones and addresses. Review queues were officially described as 'longer than usual' in February 2026, and the distribution method can never be changed once chosen.",
    "time_to_first_connection": "30-60 minutes (Dev Dashboard app + development store)",
    "time_to_production": "Single merchant via custom distribution: same day. Arbitrary merchants via public distribution: roughly 4-10 weeks (estimate: 1-4 weeks of building to App Store requirements plus a review queue that community reports put at ~30 days in 2026).",
    "hands_on_effort": "~1 hour for custom distribution; roughly 3-8 developer-days for a public app (embedded/admin UI, Billing API if you charge, compliance webhooks, protected-data controls, listing and reviewer test credentials). Estimate.",
    "approval_wait": "Public distribution (listed or unlisted) requires Shopify App Store review; protected customer data access for public apps is reviewed with that submission. Shopify publishes no SLA; a Shopify staff post (Feb 2026) says review times are longer than usual and resubmitting moves you to the back of the queue. Custom distribution and development stores need no review.",
    "cost": "Custom distribution: free. Public distribution: one-time $19 USD App Store registration per Partner account; 0% revenue share on the first $1M USD lifetime app revenue, 15% above (if you bill through Shopify). Public apps must bill through Shopify App Pricing / Billing API.",
    "confidence": "medium"
  },
  "phases": [
    {
      "name": "Register",
      "goal": "Have a Shopify app with a client ID/secret and a development store to test on.",
      "duration": "15-30 minutes",
      "is_wait": false,
      "steps": [
        {
          "title": "Sign in to the Dev Dashboard (Partner organization)",
          "detail": "Create or sign in to a Shopify developer/Partner organization. The Dev Dashboard is now the central place to build apps and replaces the Partner Dashboard. Use a Partner organization (not a merchant store organization) if you intend to serve stores you do not own.",
          "owner": "you",
          "agent_help": "",
          "link": "https://dev.shopify.com/dashboard",
          "sources": ["s11", "s2"]
        },
        {
          "title": "Create the app and copy client ID and secret",
          "detail": "Create an app in the Dev Dashboard (recommended for API-only/automation apps with no admin UI) or via Shopify CLI (recommended if you will need an embedded UI for App Store review). Client ID and secrets live only in the Dev Dashboard, not in shopify.app.toml.",
          "owner": "agent+you",
          "agent_help": "Agent can scaffold the app with Shopify CLI (shopify.app.toml, auth section, scopes) and tell you exactly which Dev Dashboard fields to copy; you click create and copy the secret into your secret store.",
          "link": "https://shopify.dev/docs/apps/build/dev-dashboard",
          "sources": ["s11"]
        },
        {
          "title": "Create a development store",
          "detail": "Development stores can install apps of either distribution type and can access protected customer data in development after you select the fields, without review.",
          "owner": "you",
          "agent_help": "",
          "link": "https://dev.shopify.com/dashboard",
          "sources": ["s1", "s6"]
        }
      ]
    },
    {
      "name": "Configure scopes and redirect",
      "goal": "Declare the minimum scopes and register the redirect URI the OAuth flow will use.",
      "duration": "15-30 minutes",
      "is_wait": false,
      "steps": [
        {
          "title": "Declare minimum access scopes",
          "detail": "Put scopes in [access_scopes] scopes in shopify.app.toml and release a version. Typical agent set: read_orders/write_orders, read_customers/write_customers, read_products/write_products, read_draft_orders/write_draft_orders. read_orders only reaches the last 60 days; add read_all_orders for history (Partner-org apps must request approval first). Scopes marked 'Shopify approval required' fail app version creation with an app_access validation error until approved.",
          "owner": "agent",
          "agent_help": "Agent maps your agent's tools to the smallest scope list, writes the TOML, and runs `shopify app deploy`/release; it can query currentAppInstallation.accessScopes afterwards to confirm what was granted.",
          "link": "https://shopify.dev/docs/api/usage/access-scopes",
          "sources": ["s5"]
        },
        {
          "title": "Register the redirect URI",
          "detail": "Add the callback URL to the app's allowed redirect URLs in the Dev Dashboard or the [auth] section of shopify.app.toml. The redirect_uri sent at authorize time must exactly match one configured URI.",
          "owner": "agent+you",
          "agent_help": "Agent writes redirect_urls into shopify.app.toml and deploys; if you configure via the Dev Dashboard, you paste the URL the agent gives you.",
          "link": "https://shopify.dev/docs/apps/build/authentication-authorization/access-tokens/authorization-code-grant",
          "sources": ["s3"]
        }
      ]
    },
    {
      "name": "Choose distribution",
      "goal": "Decide whether this app serves one merchant (custom) or many (public). This choice is permanent.",
      "duration": "5 minutes to decide; custom install link is instant",
      "is_wait": false,
      "steps": [
        {
          "title": "Pick custom or public distribution (irreversible)",
          "detail": "Custom distribution: one store, stores in the same Plus organization, or development stores; no App Store review; cannot use Shopify's billing system. Public distribution: many merchants; App Store review required; listing can be unlisted but review still applies. The method can't be changed after selection, so if you need both, create two apps.",
          "owner": "you",
          "agent_help": "Agent can lay out the trade-off for your launch plan (e.g., one custom app for a design partner now, a separate public app for general availability).",
          "link": "https://shopify.dev/docs/apps/launch/distribution/select-distribution-method",
          "sources": ["s1", "s2", "s13"]
        },
        {
          "title": "Custom distribution: generate an install link",
          "detail": "In the app's Distribution card, enter the merchant's myshopify.com or admin.shopify.com domain, optionally allow multi-store installs for one Plus organization, generate the link and send it to the store owner.",
          "owner": "agent+you",
          "agent_help": "Agent can draft the email to the merchant explaining the requested scopes; you generate and send the link.",
          "link": "https://shopify.dev/docs/apps/launch/distribution/select-distribution-method",
          "sources": ["s2"]
        }
      ]
    },
    {
      "name": "Connect to Composio",
      "goal": "Route the Shopify OAuth flow through Composio using your own app credentials.",
      "duration": "15-30 minutes",
      "is_wait": false,
      "steps": [
        {
          "title": "Create a custom auth config in Composio",
          "detail": "In the Composio dashboard choose Create Auth Config, select the Shopify toolkit with OAuth2, paste your Shopify client ID and client secret and the scopes you declared, then save and keep the auth config ID (ac_...) to pass when creating sessions.",
          "owner": "agent+you",
          "agent_help": "Agent can prepare the exact scope string and write the session code that passes auth_configs={'shopify': 'ac_...'}; you paste the secret into the dashboard.",
          "link": "https://docs.composio.dev/docs/authentication/custom-app-vs-managed-app",
          "sources": ["s14"]
        },
        {
          "title": "Register Composio's callback as the redirect URI",
          "detail": "Add https://backend.composio.dev/api/v3/toolkits/auth/callback (or the exact URI the Composio dashboard shows for your auth config) to the Shopify app's redirect URLs. Some toolkits still default to the legacy https://backend.composio.dev/api/v1/auth-apps/add, so copy whatever the dashboard displays; it must match exactly.",
          "owner": "agent+you",
          "agent_help": "Agent adds the URI to shopify.app.toml redirect_urls and deploys, then compares it character-for-character with the Composio dashboard value.",
          "link": "https://docs.composio.dev/docs/authentication/white-labeling-authentication",
          "sources": ["s15", "s14", "s3"]
        },
        {